{
    "$schema": "../thesisproposal.json",
    "thesisProposalId": 1,
    "title": "Research in Computer Science",
    "supervisor": "p123456",
    "coSupervisor": [
        "p789632",
        "e123456"
    ],
    "keywords": [
        "company"
    ],
    "notes": "Nothing",
    "thesisType": {
        "inCompany": false,
        "abroad": false
    },
    "groups": [
        "AI-group"
    ],
    "description": "Beautiful thesis",
    "requirements": "C",
    "expirationDate": "2025-12-01",
    "level": "MSc",
    "CdS": [
        "Computer science"
    ],
    "isArchieved": false
}